<?xml version='1.0' encoding='UTF-8'?>
<!DOCTYPE clientes SYSTEM "clientes.dtd">
<clientes>
    <sede codigoSede= "A1234567">
        <direccion>Sevilla</direccion>
        <direccion>Sevilla</direccion>
        <empleado>Francisco</empleado>
        <fecha>22/11/2020</fecha>
        <descripcion>Casa adosada</descripcion>
        <cliente codigoCliente= "ABC-123">
            <numeroVivienda>1</numeroVivienda>
            <coste>132674.64</coste>
            <resumen>Solvente</resumen>
            <plazo>25</plazo>
        </cliente>
    </sede>
</clientes>